[
  {
    "legacy_id": "0",
    "kind": "map_price",
    "source_file": "config/main.json",
    "source_layer": "stored",
    "content_version": "004ba829043dfb00d78888a764bd7e13a37db9c5c05195cd910ac3d570678bb3",
    "position": 0,
    "coins": 100000,
    "cash": 20,
    "level": 15
  },
  {
    "legacy_id": "1",
    "kind": "map_price",
    "source_file": "config/main.json",
    "source_layer": "stored",
    "content_version": "004ba829043dfb00d78888a764bd7e13a37db9c5c05195cd910ac3d570678bb3",
    "position": 1,
    "coins": 300000,
    "cash": 20,
    "level": 25
  },
  {
    "legacy_id": "2",
    "kind": "map_price",
    "source_file": "config/main.json",
    "source_layer": "stored",
    "content_version": "004ba829043dfb00d78888a764bd7e13a37db9c5c05195cd910ac3d570678bb3",
    "position": 2,
    "coins": 550000,
    "cash": 20,
    "level": 35
  },
  {
    "legacy_id": "3",
    "kind": "map_price",
    "source_file": "config/main.json",
    "source_layer": "stored",
    "content_version": "004ba829043dfb00d78888a764bd7e13a37db9c5c05195cd910ac3d570678bb3",
    "position": 3,
    "coins": 1000000,
    "cash": 20,
    "level": 45
  }
]
